{"schemaVersion":1,"exerciseCode":"MACHINE_SHOULDER_PRESS","exerciseName":"器械肩推","variant":"坐姿背靠固定轨迹肩推顶端姿势","representativePose":"人物坐在器械靠背上，双手握固定把手向上推至接近顶端，双肘对称。","camera":{"view":"45°前侧视角，展示座椅、靠背、把手和轨迹结构","subjectFill":"完整显示人物、器械框架、双侧把手与底座","safeMarginPercent":8},"equipment":{"family":"双臂固定轨迹肩推机","recognitionFeatures":["座椅和靠背","左右联动推举臂与固定握把","机械转轴或配重结构","无自由杠铃"]},"grip":"双手闭合中立握固定把手","bodyContacts":["背部贴靠背","臀部接触座椅","双手握把","双脚着地"],"jointDirections":["肩关节向上推","肘部接近伸直不过伸","躯干稳定","腕部中立"],"primaryMuscles":["三角肌前束"],"secondaryMuscles":["三角肌中束","肱三头肌"],"rejectionCases":["杠铃或哑铃","器械飞鸟或胸推轨迹","站姿推举","把手与手错位","器械底座被裁切"]}
