{
  "schemaVersion": 1,
  "exerciseCode": "GOBLET_SQUAT",
  "exerciseName": "高脚杯深蹲",
  "variant": "双手胸前托单只六角哑铃的高脚杯深蹲底部代表姿势",
  "representativePose": "人物双脚略宽于肩、脚尖轻微外旋，髋膝屈曲至深蹲底部；双手托住一只竖直六角哑铃并贴近胸骨，胸廓抬起、脊柱中立、双脚全掌着地。",
  "camera": {
    "view": "45° 前侧视角，弱透视，同时看清胸前单只哑铃、双手位置、髋膝深度和双脚",
    "subjectFill": "完整显示人物、单只六角哑铃和双脚；不出现第二只哑铃、杠铃或无关器械",
    "safeMarginPercent": 8
  },
  "equipment": {
    "family": "单只六角哑铃自由重量深蹲",
    "recognitionFeatures": [
      "仅一只竖直六角哑铃位于胸前",
      "哑铃两端和中间握柄清楚可辨",
      "双手在哑铃一端托举并左右对称",
      "没有杠铃、深蹲架、器械靠垫或第二只哑铃"
    ]
  },
  "grip": "双手掌心向内托住同一只哑铃的一端，哑铃竖直贴近胸前",
  "bodyContacts": ["双手握住同一只哑铃", "哑铃贴近胸前但不压颈部", "双脚全掌接触地面"],
  "jointDirections": ["髋关节和膝关节同步屈曲", "膝盖沿脚尖方向移动", "躯干保持挺直并避免塌腰", "脚跟不抬起"],
  "primaryMuscles": ["股四头肌"],
  "secondaryMuscles": ["臀大肌", "内收肌群", "腘绳肌", "核心肌群"],
  "rejectionCases": [
    "出现两只哑铃、杠铃、壶铃或器械深蹲结构",
    "哑铃远离胸前、仅单手持握或双手位置不对称",
    "人物处于站立、硬拉或弓步而非双脚深蹲",
    "膝盖明显内扣、脚跟离地、背部明显弓曲",
    "哑铃、手脚或头部被裁切"
  ]
}
