{
  "schemaVersion": 1,
  "exerciseCode": "OHP",
  "exerciseName": "站姿杠铃推举",
  "variant": "严格站姿杠铃过顶推举，无腿部借力，接近顶部锁定的代表姿势",
  "representativePose": "人物双脚约髋宽站立，躯干和骨盆稳定，杠铃位于头顶并与肩、髋和中足大致垂直堆叠；双肘接近伸直但不反张，头部回到双臂之间。",
  "camera": {
    "view": "45° 前侧视角，弱透视，清楚显示杠铃过顶位置、双肘和全身直线",
    "subjectFill": "完整显示人物、整根杠铃、两侧小型杠铃片和双脚，头顶保留充足安全边距",
    "safeMarginPercent": 10
  },
  "equipment": {
    "family": "标准奥林匹克杠铃站姿严格推举",
    "recognitionFeatures": [
      "一根位于头顶的直奥杆",
      "杠铃两端对称安装小型圆形杠铃片和卡扣",
      "杠铃水平且位于身体中线正上方",
      "无史密斯导轨、坐姿靠背或腿部推动器械"
    ]
  },
  "grip": "双手闭合正握，握距略宽于肩，手腕接近中立，前臂和双手左右对称",
  "bodyContacts": ["双手握住杠铃", "双脚全掌接触地面"],
  "jointDirections": ["肩关节上举并保持左右对称", "双肘接近伸直且不过伸", "腕关节接近中立", "躯干垂直且肋骨不过度外翻", "膝关节保持伸展但不反张"],
  "primaryMuscles": ["三角肌前束"],
  "secondaryMuscles": ["肱三头肌", "三角肌中束"],
  "rejectionCases": [
    "借腿推举、挺举、坐姿推举、颈后推举或史密斯推举",
    "杠铃停在胸前而未体现过顶动作",
    "明显后仰、腰椎过伸、肋骨外翻或膝髋屈伸借力",
    "杠铃位于身体前方过远或左右倾斜",
    "杠铃片左右不等、手穿过杠铃或头部与杠铃重叠错误",
    "头顶杠铃、双手或双脚被裁切"
  ]
}
