{
  "schemaVersion": 1,
  "exerciseCode": "INCLINE_HAMMER_CHEST_PRESS",
  "exerciseName": "上斜悍马机推胸",
  "variant": "约 30 度靠背的悍马机上斜推胸，手柄位于上胸两侧代表姿势",
  "representativePose": "人物坐在约 30 度上斜靠背悍马机，头、上背、臀部贴靠，双脚踩踏板；双手握住独立手柄，肘部约 45 至 60 度外展，手柄位于锁骨下方回程位置。",
  "camera": { "view": "45° 前侧略俯视角，弱透视，靠背上斜角度、独立推臂和加载片明确", "subjectFill": "完整显示人物、上斜靠背、双机械臂、手柄、圆盘片和底座；不出现平躺凳或长杠铃", "safeMarginPercent": 8 },
  "equipment": { "family": "标准 plate-loaded 悍马机上斜胸推", "recognitionFeatures": ["座椅靠背约 30 度上斜", "左右独立推胸臂与圆盘加载轴", "手柄与上胸同高并向前上方运行", "固定低位脚踏与厚重底座"] },
  "grip": "双手各自闭合中立握住独立手柄，腕部与前臂对齐",
  "bodyContacts": ["头部、上背和臀部接触上斜靠背", "双脚踩踏板", "双手各握一只独立手柄"],
  "jointDirections": ["躯干相对垂直约后倾 30 度", "肘部约 45 至 60 度外展", "手柄与锁骨下方同高", "左右推臂轨迹对称"],
  "primaryMuscles": ["胸大肌上部"],
  "secondaryMuscles": ["三角肌前束", "肱三头肌"],
  "rejectionCases": ["水平或下斜悍马机、普通器械推胸", "靠背角度无法辨认或接近水平", "没有独立推臂、圆盘加载轴或脚踏", "手柄位于腹部或头顶", "人物、器械、配重片或双脚被裁切"]
}
