{"schemaVersion":1,"exerciseCode":"MACHINE_LATERAL_RAISE","exerciseName":"器械侧平举","variant":"坐姿固定轨迹双臂侧平举顶端姿势","representativePose":"人物坐在器械座椅上，双臂贴靠软垫或握固定把手沿轨迹抬至肩高，躯干贴靠背垫。","camera":{"view":"45°前侧视角，显示座椅、靠背、臂垫和转轴","subjectFill":"完整显示人物、双侧臂垫、机械臂、座椅和底座","safeMarginPercent":8},"equipment":{"family":"双臂固定轨迹侧平举机","recognitionFeatures":["坐姿靠背","左右软垫或固定握把","双侧转轴和连杆","无自由哑铃"]},"grip":"双手闭合握固定把手或中立贴靠臂垫","bodyContacts":["背部贴靠背","臀部接触座椅","前臂或手接触臂垫/把手","双脚着地"],"jointDirections":["双肩外展至肩高","肘部微屈","躯干固定","腕部中立"],"primaryMuscles":["三角肌中束"],"secondaryMuscles":[],"rejectionCases":["自由哑铃或绳索侧平举","推举向上超过头顶","无座椅或臂垫","双侧结构不对称","器械被裁切"]}
