{"schemaVersion":1,"exerciseCode":"FRONT_RAISE","exerciseName":"哑铃前平举","variant":"站姿双哑铃前平举肩高顶端姿势","representativePose":"人物站立，双手各持哑铃从大腿前方抬至肩高，双臂向前平行、肘部微屈。","camera":{"view":"45°前侧视角，显示双哑铃与双臂前举方向","subjectFill":"完整显示人物、两只哑铃和双脚，四周留白","safeMarginPercent":10},"equipment":{"family":"一对哑铃","recognitionFeatures":["左右各一只独立哑铃","哑铃位于身体正前方肩高","无杠铃或绳索"]},"grip":"双手闭合中立握哑铃","bodyContacts":["双手握哑铃","双脚全掌着地"],"jointDirections":["肩关节屈曲至肩高","肘部微屈","躯干直立不后仰","腕部中立"],"primaryMuscles":["三角肌前束"],"secondaryMuscles":[],"rejectionCases":["侧平举或过顶推举","单臂动作","杠铃、杠铃片或绳索","摆动借力后仰","哑铃或手被裁切"]}
