{"schemaVersion":1,"exerciseCode":"EZ_BAR_PREACHER_CURL","exerciseName":"牧师凳 EZ 杠弯举","variant":"牧师凳双臂 EZ 曲杆弯举顶端姿势","representativePose":"人物坐在窄高牧师凳上，双臂前侧贴斜垫，双手握 EZ 曲杆从下方弯举。","camera":{"view":"45°前侧视角，清楚显示窄高牧师凳斜垫和曲杆","subjectFill":"完整显示人物、牧师凳、EZ 杠、杠片和双脚","safeMarginPercent":8},"equipment":{"family":"牧师凳与 EZ 曲杆","recognitionFeatures":["窄高顶部圆角斜垫","双臂贴斜垫","中部弯曲 EZ 杆与圆片","非普通上斜凳"]},"grip":"双手闭合半旋前握 EZ 杆","bodyContacts":["上臂/腋下贴牧师凳斜垫","臀部接触座椅","双手握 EZ 杆","双脚着地"],"jointDirections":["肘关节屈曲","上臂由斜垫固定","肩部不前移","腕部中立"],"primaryMuscles":["肱二头肌"],"secondaryMuscles":[],"rejectionCases":["直杠或哑铃","普通上斜凳或平凳","站姿弯举","无明显牧师凳斜垫","曲杆/斜垫或脚被裁切"]}
