{"schemaVersion":1,"exerciseCode":"CABLE_SINGLE_ARM_PULLDOWN","exerciseName":"单臂绳索下拉","variant":"站姿高位滑轮单臂背阔下拉底端姿势","representativePose":"人物站在高位滑轮侧前方，一手握单把手从头顶向同侧肋骨下拉，另一手置髋部，肩胛下沉。","camera":{"view":"45°后侧视角，清楚显示单把手、钢索和背阔肌收缩","subjectFill":"完整显示人物、滑轮塔、单根钢索、把手和双脚","safeMarginPercent":8},"equipment":{"family":"高位滑轮单把手","recognitionFeatures":["高位滑轮塔","单根钢索连接单把手","单侧工作臂从头顶下拉","非工作手置髋部"]},"grip":"工作手闭合中立握把手","bodyContacts":["工作手握把手","非工作手可置髋部","双脚着地"],"jointDirections":["工作肩关节内收下压","肘部向同侧肋骨下拉","肩胛骨下沉后缩","躯干保持稳定"],"primaryMuscles":["背阔肌"],"secondaryMuscles":["肱二头肌","三角肌后束"],"rejectionCases":["双臂高位下拉","单臂绳索划船","把手从低位向后拉","钢索未连接把手","滑轮、把手或脚被裁切"]}
