{"schemaVersion":1,"exerciseCode":"REAR_DELT_FLY","exerciseName":"俯身飞鸟","variant":"站姿髋折叠双哑铃俯身后束飞鸟顶端姿势","representativePose":"人物髋部折叠、背部平直，双手各持哑铃向两侧打开至肩高，头部与脊柱保持中立。","camera":{"view":"45°侧前视角，显示俯身角度、双臂和哑铃","subjectFill":"完整显示人物、两只哑铃和双脚","safeMarginPercent":10},"equipment":{"family":"一对哑铃","recognitionFeatures":["双手各一只哑铃","躯干明显前倾","双臂向侧后方打开","无凳子或器械"]},"grip":"双手闭合中立握哑铃","bodyContacts":["双手握哑铃","双脚着地"],"jointDirections":["肩关节水平外展","肘部微屈","髋部折叠且背部平直","颈部中立"],"primaryMuscles":["三角肌后束"],"secondaryMuscles":["斜方肌","菱形肌"],"rejectionCases":["站直做侧平举","胸托器械或牧师凳","背部弓起或耸肩","只显示单臂","哑铃或脚被裁切"]}
