{
  "schemaVersion": 1,
  "exerciseCode": "DECLINE_BB_PRESS",
  "exerciseName": "下斜杠铃卧推",
  "variant": "约 15 至 25 度下斜杠铃卧推，杠铃位于中下胸底部代表姿势",
  "representativePose": "人物仰卧在头部低于膝部的下斜训练凳，肩胛与臀部接触靠背，双脚由脚垫固定；双手闭合握住带等重片的杠铃，杠铃下降至胸骨下段，双肘约 45 至 60 度外展。",
  "camera": { "view": "45° 前侧略俯视角，弱透视，明确显示凳面向头侧下倾、脚垫和杠铃", "subjectFill": "完整显示人物、下斜凳、脚垫、杠铃及两侧杠铃片；不出现哑铃", "safeMarginPercent": 8 },
  "equipment": { "family": "标准下斜杠铃卧推架、下斜凳与脚踝固定垫", "recognitionFeatures": ["凳面头侧低于臀部并有明显脚踝固定垫", "杠铃横跨双手且两侧有等尺寸杠铃片", "卧推架立柱与凳面同向", "无独立哑铃或上斜靠背"] },
  "grip": "双手略宽于肩闭合正握杠铃，腕部与前臂对齐",
  "bodyContacts": ["头部和上背接触下斜靠背", "臀部接触凳面", "双脚或脚踝由固定垫支撑", "双手握住同一根杠铃"],
  "jointDirections": ["头部低于膝部约 15 至 25 度", "杠铃路径指向中下胸", "双肘屈曲约 45 至 60 度", "腕关节不明显后折"],
  "primaryMuscles": ["胸大肌下部"],
  "secondaryMuscles": ["三角肌前束", "肱三头肌"],
  "rejectionCases": ["水平或上斜凳、肩推、哑铃卧推", "凳面没有下斜角或缺少脚踝固定垫", "杠铃落在颈部或腹部", "杠铃片不对称、杠铃断裂或出现第三只杠铃", "人物、杠铃、凳子或双脚被裁切"]
}
