{
  "schemaVersion": 1,
  "exerciseCode": "SHRUG_BB",
  "exerciseName": "杠铃耸肩",
  "variant": "双手前方持杠、双肘伸直并将肩膀抬向耳朵的站姿顶峰代表姿势",
  "representativePose": "人物双脚髋宽站立，双臂自然下垂并在大腿前方握住直杠；双肘保持伸直，肩峰明显向耳朵上提，颈部保持中立，不做肘屈曲或肩部绕圈。",
  "camera": {
    "view": "45° 前侧视角，弱透视，清楚显示直杠前方位置、伸直双臂、抬高肩峰和双脚",
    "subjectFill": "完整显示人物、整根杠铃、左右对称配重片和双脚；不出现深蹲架或耸肩机",
    "safeMarginPercent": 8
  },
  "equipment": {
    "family": "直杠自由重量耸肩",
    "recognitionFeatures": [
      "直杠位于大腿前方并由双手握持",
      "双肘完全伸直，肩峰向上抬高",
      "杠铃两端对称圆形配重片和卡扣",
      "无弯举、划船或器械靠垫结构"
    ]
  },
  "grip": "双手闭合正握杠铃，握距略宽于肩，手臂垂直向下",
  "bodyContacts": ["双手握住杠铃", "双脚全掌接触地面"],
  "jointDirections": ["肩胛骨向上旋转并抬高肩峰", "肘关节保持伸直", "躯干和髋部保持直立", "避免耸肩绕圈或借力摆动"],
  "primaryMuscles": ["斜方肌上束"],
  "secondaryMuscles": ["提肩胛肌", "前臂屈肌群", "核心稳定肌群"],
  "rejectionCases": [
    "肘部明显弯曲、杠铃向胸口卷起，变成杠铃弯举",
    "杠铃位于上背或头顶，变成深蹲/推举",
    "肩膀未抬高、躯干前倾或使用摆动代偿",
    "杠铃片缺失、杠杆倾斜或出现器械耸肩垫",
    "人物、杠铃、配重或双脚被裁切"
  ]
}
