{
  "schemaVersion": 1,
  "exerciseCode": "CHEST_SUPPORTED_T_BAR_ROW",
  "exerciseName": "胸托 T 杠划船",
  "variant": "参考 Lever Reverse T Bar Row 的胸托片式 T 杠杠杆划船机顶端收缩姿势",
  "representativePose": "人物俯卧在片式杠杆划船机的上斜胸托上，上胸和胸骨区域贴住黑色胸垫，头颈保持中立并略向下；双膝微屈，双脚稳定踩在固定脚踏上。双手闭合中立握胸垫下方两侧的独立杠杆把手，肘部向后并略向下拉向下肋，动作顶端把手靠近下胸或上腹，肩胛骨后缩而躯干不离开胸垫。",
  "camera": {
    "view": "45°前侧弱透视视角，人物俯卧朝向器械，能同时看清上斜胸垫、双手中立握把、两侧杠杆臂、装片杆与杠片、脚踏和双脚",
    "subjectFill": "完整显示人物、胸托、T 杠杠杆架、双侧把手、杠片、脚踏和双脚，保留至少 8% 安全边距",
    "safeMarginPercent": 8
  },
  "equipment": {
    "family": "胸托片式 T 杠杠杆划船机（Lever Reverse T Bar Row）",
    "recognitionFeatures": [
      "独立器械底座与上斜黑色胸托，上胸和胸骨区域贴垫",
      "两侧独立杠杆臂汇入 T 杠架，不出现钢索、滑轮或自由杠铃",
      "胸垫下方有双侧中立握把，掌心相对，左右把手与杠杆轴线一致",
      "杠杆远端装有可辨认的杠片，杠片真实挂在装片杆上",
      "胸托下方有固定脚踏，双脚稳定接触，膝盖保持轻微屈曲"
    ]
  },
  "grip": "双手闭合中立握两侧独立杠杆把手，掌心相对，腕部保持中立；把手必须实际位于手掌内，不被手腕穿过",
  "bodyContacts": [
    "上胸和胸骨区域持续贴住上斜胸垫",
    "双手包住两侧独立杠杆把手",
    "双脚稳定踩住固定脚踏，膝盖微屈",
    "躯干由胸垫固定，不能靠腰背摆动完成划船"
  ],
  "jointDirections": [
    "双肘沿身体两侧向后并略向下移动，终点靠近下肋而不是向外张开",
    "肩胛骨随拉动向后缩，颈部保持中立，头部不抬起借力",
    "胸部全程贴住胸垫，脊柱保持稳定，不出现站姿俯身划船的躯干摆动",
    "腕部保持中立，双手与把手轴线一致，杠杆两侧运动对称",
    "回放阶段控制杠杆前移，杠片始终位于真实装片杆上"
  ],
  "primaryMuscles": ["背阔肌", "菱形肌"],
  "secondaryMuscles": ["肱二头肌", "三角肌后束", "前臂"],
  "rejectionCases": [
    "没有胸托的站姿 T 杠划船或俯身杠铃划船",
    "自由杠铃一端固定地面的 landmine 划船，而不是片式杠杆 T 杠机器",
    "上斜凳胸托杠铃划船、哑铃划船或普通坐姿绳索划船",
    "绳索、滑轮、D 把手、V 把手或直杆替代独立杠杆把手",
    "胸部没有贴住胸垫、躯干悬空或通过腰背摆动完成动作",
    "肘部向外张成宽肘飞鸟路线，而不是向后略向下贴近下肋",
    "杠片悬空、没有装在杠杆远端装片杆上，或器械两侧不对称",
    "把手与手错位、手指融合、脚踏或双脚被裁切"
  ]
}
