{"schemaVersion":1,"exerciseCode":"OVERHEAD_TRICEP_EXT","exerciseName":"哑铃过顶臂屈伸","variant":"站姿双手单哑铃过顶臂屈伸顶端姿势","representativePose":"人物站立，双手合握一只哑铃举过头顶，肘部接近伸直，哑铃位于头顶正上方。","camera":{"view":"45°前侧视角，清楚显示单只哑铃、双手和过顶肘部","subjectFill":"完整显示人物、单只哑铃和双脚","safeMarginPercent":10},"equipment":{"family":"单只哑铃","recognitionFeatures":["一只被双手合握的哑铃","哑铃位于头顶上方","双肘接近耳侧","无杠铃或钢索"]},"grip":"双手合握哑铃一端或哑铃杆","bodyContacts":["双手握单只哑铃","双脚着地"],"jointDirections":["双肘伸展至过顶","上臂接近耳侧","躯干直立","腕部中立"],"primaryMuscles":["肱三头肌"],"secondaryMuscles":[],"rejectionCases":["双哑铃推肩","钢索或杠铃","哑铃位于胸前","肘部明显外翻或躯干后仰","哑铃、头顶或脚被裁切"]}
