{
  "schemaVersion": 1,
  "exerciseCode": "PEC_DECK_FLY",
  "exerciseName": "蝴蝶机夹胸",
  "variant": "常规选择片式蝴蝶机夹胸，双手握垂直把手，开放位代表姿势",
  "representativePose": "人物坐姿直立，整个背部贴靠垂直靠垫，双脚平放；双上臂接近肩高，肘部微屈约 15 度，双手对称握住开放位垂直把手。",
  "camera": {
    "view": "45° 前侧视角，弱透视，胸部与器械关系清晰",
    "subjectFill": "完整显示人物、座椅、靠背、双握把、双摆臂、顶部转轴、必要机架和配重塔",
    "safeMarginPercent": 8
  },
  "equipment": {
    "family": "顶部横梁式常规选择片蝴蝶机",
    "recognitionFeatures": [
      "中央可调座椅与垂直靠背",
      "左右立柱由顶部横梁连接",
      "横梁两端固定对称凸轮或轴承转轴",
      "两条向外向下弯曲的刚性摆臂",
      "摆臂末端连续连接垂直中立握把",
      "侧置配重片塔、双导杆与可解释钢索或凸轮联动"
    ]
  },
  "grip": "双手中立握法握住垂直把手，手腕中立，左右高度和距离对称",
  "bodyContacts": ["背部贴靠背垫", "臀部接触座垫", "双脚完整着地", "双手握住垂直把手"],
  "jointDirections": ["肩关节水平外展开放位", "双肘保持轻微屈曲", "腕关节中立", "头颈中立且肩胛稳定"],
  "primaryMuscles": ["胸大肌"],
  "secondaryMuscles": ["三角肌前束"],
  "rejectionCases": [
    "胸推机或向前推举姿势",
    "绳索夹胸站姿或独立拉索塔",
    "左右肩旁独立短直臂且没有顶部横梁",
    "只有前臂垫而没有垂直握把的变体",
    "摆臂、转轴、钢索或配重悬空断裂",
    "背部离垫、双脚悬空、肘部锁死或左右不对称",
    "复制 style-v1 中旧人物的脸而不是 character-v1"
  ]
}
