{"schemaVersion":1,"exerciseCode":"SMITH_SHOULDER_PRESS","exerciseName":"史密斯肩推","variant":"坐姿史密斯导轨杠铃肩推顶端姿势","representativePose":"人物坐在靠背凳上，在两根垂直导轨之间将史密斯杠铃推至头顶，杠铃保持水平。","camera":{"view":"45°前侧视角，显示双导轨、挂钩和靠背","subjectFill":"完整显示人物、史密斯架、杠铃、凳子和双脚","safeMarginPercent":8},"equipment":{"family":"史密斯机坐姿肩推","recognitionFeatures":["左右垂直导轨","固定路径杠铃和挂钩","靠背凳位于导轨中央","杠铃片左右对称"]},"grip":"双手正握史密斯杠铃，握距略宽于肩","bodyContacts":["背部贴靠背","臀部接触坐垫","双手握杠铃","双脚着地"],"jointDirections":["肩关节上举","肘部接近伸直不过伸","躯干垂直","腕部中立"],"primaryMuscles":["三角肌前束"],"secondaryMuscles":["三角肌中束","肱三头肌"],"rejectionCases":["无导轨自由杠铃","杠铃在胸前或深蹲","站姿或借腿","导轨/杠铃/脚被裁切","左右板片不对称"]}
