{
  "schemaVersion": 1,
  "exerciseCode": "KB_DEADLIFT",
  "exerciseName": "壶铃硬拉",
  "variant": "双手握住身体正中壶铃、髋部后移并从地面起拉的壶铃硬拉起始段代表姿势",
  "representativePose": "人物双脚约髋宽，膝盖轻微屈曲，髋部向后折叠，躯干前倾但脊柱中立；双手握住位于双脚之间、贴近地面的单只壶铃把手，双脚全掌着地。",
  "camera": {
    "view": "45° 前侧视角，弱透视，清楚显示双手同握壶铃、壶铃位于双脚之间和髋铰链",
    "subjectFill": "完整显示人物、单只壶铃和双脚；不出现杠铃、哑铃或器械",
    "safeMarginPercent": 8
  },
  "equipment": {
    "family": "单只壶铃髋铰链硬拉",
    "recognitionFeatures": [
      "一只圆球壶铃位于双脚之间",
      "双手同时握住壶铃顶部把手",
      "双脚约髋宽、膝盖轻微屈曲",
      "没有杠铃杆、哑铃或训练器械"
    ]
  },
  "grip": "双手闭合握住同一只壶铃的顶部把手，手臂在身体正中下垂",
  "bodyContacts": ["双手握住壶铃把手", "双脚全掌接触地面"],
  "jointDirections": ["髋关节向后折叠并保持主导", "膝关节轻微屈曲", "脊柱保持中立且胸廓稳定", "壶铃贴近身体沿垂直方向起拉"],
  "primaryMuscles": ["臀大肌", "腘绳肌"],
  "secondaryMuscles": ["股四头肌", "竖脊肌", "前臂屈肌群", "核心肌群"],
  "rejectionCases": [
    "壶铃缺失、被杠铃或哑铃替代，或出现两只壶铃",
    "双腿深度屈曲成为深蹲，或动作完全由腰部弯曲完成",
    "双手分开、壶铃远离双脚之间或背部明显弓曲",
    "人物处于直立锁定，无法辨认硬拉起始姿势",
    "人物、壶铃、双脚或把手被裁切"
  ]
}
