{"schemaVersion":1,"exerciseCode":"SINGLE_ARM_CABLE_CURL","exerciseName":"单臂绳索弯举","variant":"站姿低位滑轮单臂弯举顶端姿势","representativePose":"人物站在低位滑轮侧前方，一手握单把手弯举至肩前，另一手置于髋部，钢索保持张力。","camera":{"view":"45°侧前视角，突出工作臂、单把手和低位钢索","subjectFill":"完整显示人物、滑轮塔、单根钢索、把手和双脚","safeMarginPercent":8},"equipment":{"family":"低位滑轮单把手","recognitionFeatures":["低位滑轮塔","一根钢索连接单把手","单侧工作臂","非工作手置髋部"]},"grip":"工作手闭合旋后握单把手","bodyContacts":["工作手握把手","非工作手可置髋部","双脚着地"],"jointDirections":["工作肘屈曲","肘部靠近躯干","肩部不耸起","腕部中立"],"primaryMuscles":["肱二头肌"],"secondaryMuscles":[],"rejectionCases":["双臂绳索弯举","哑铃或杠铃","绳索下压","钢索未连接把手","人物、把手或脚被裁切"]}
