{
  "schemaVersion": 1,
  "exerciseCode": "HACK_SQUAT",
  "exerciseName": "哈克深蹲",
  "variant": "45° 轨道哈克深蹲，肩垫承重、双脚踩斜面脚踏板的底部代表姿势",
  "representativePose": "人物背部和肩部贴靠滑车靠垫，双肩压在肩垫下，双脚略宽于髋并全掌踩在斜面脚踏板上；髋膝屈曲至可辨深度，膝盖与脚尖同向，双手握住安全把手。",
  "camera": {
    "view": "45° 前侧视角，弱透视，同时看清肩垫、滑轨、斜面脚踏板、双脚和双侧配重",
    "subjectFill": "完整显示人物、哈克机滑车、双侧轨道、脚踏板和配重片；不出现健身房背景或无关器械",
    "safeMarginPercent": 8
  },
  "equipment": {
    "family": "标准 45° 轨道哈克深蹲机",
    "recognitionFeatures": [
      "双侧倾斜导轨和可滑动承重车",
      "肩部双垫与背部靠垫固定人物",
      "明显的斜面大脚踏板和安全止挡",
      "左右对称安装圆形配重片",
      "不能出现自由杠铃、史密斯导轨或腿举座舱"
    ]
  },
  "grip": "双手闭合握住肩垫附近的安全把手，左右对称",
  "bodyContacts": ["背部贴靠背垫", "双肩接触肩垫", "双脚全掌接触斜面脚踏板", "双手握住安全把手"],
  "jointDirections": ["髋关节和膝关节同步屈曲", "膝盖沿脚尖方向移动", "躯干沿滑轨保持稳定", "脚跟不离开脚踏板"],
  "primaryMuscles": ["股四头肌"],
  "secondaryMuscles": ["臀大肌", "腘绳肌", "内收肌群"],
  "rejectionCases": [
    "画面缺少肩垫、斜面脚踏板或双侧轨道，无法与普通深蹲/腿举区分",
    "人物背部离开靠垫、肩垫悬空或双脚未踩在脚踏板",
    "膝盖明显内扣、脚跟抬起或左右站距严重不对称",
    "器械仅出现一侧轨道或配重，结构不完整",
    "混入自由杠铃、史密斯导轨或水平腿举座椅",
    "人物、脚踏板、滑轨或配重被裁切"
  ]
}
